"Course number","Course title","Registration restrictions","Units","Type","Section","Session","Time","Days","Seats","Registered","Waitlist","Instructor","Room"
"ACMD-501","Introduction to Academic Medicine Worldwide","M","3.0 units","Lecture","40253R","098","5:00-8:00pm","Monday","30","11","0","Julie Nyquist, Kathy Besinque",""
"ACMD-502","Becoming a Leader in Academic Medicine Worldwide","M","3.0 units","Lecture","40255R","098","5:00-8:00pm","Wednesday","30","17","0","Samuel Yanofsky, Julie Nyquist, Jerry Gates",""
"ACMD-511","Competencies in Academic Medicine and Health I","M","3.0 units","Lecture","40266R","098","5:00-8:00pm","Thursday","30","11","0","Julie Nyquist",""
"ACMD-592","Implementing Research on Innovation in Academic Medicine","PM","2.0 units","Lecture","40270R","098","5:00-7:00pm","Monday","30","13","0","Dixie Fisher, Cha-Chi Fung, Julie Nyquist",""
"ACMD-593","Foundations of Academic Writing","M","1.0 unit","Lecture","40273D","098","TBA","TBA","15","1","0","Dixie Fisher, Julie Nyquist","ONLINE"
"ACMD-598","Fieldwork: Designing Innovations for the Health Professions","M","1.0-3.0 units, max 3","Lecture","40279R","098","TBA","TBA","30","7","0","Dixie Fisher, Julie Nyquist","OFFICE"
"ACMD-621","Capstone Portfolio for the Master of Academic Medicine","M","1.0 unit","Lecture","40282R","098","TBA","TBA","30","3","0","Julie Nyquist","OFFICE"
